TITLE,TYPEID,Name,Description,Icon_color,Long,Lat,URL,Thumb_URL,주소
인제 빙어축제,43,인제 빙어축제,"인제 빙어 축제는 매년 겨울에 소양강 근처에서 열리며 수많은 가족과 연인들에게 겨울과 눈, 그리고 빙어를 즐길 수 있는 기회를 제공한다. 물론, 솔로도 방문할 수 있다!
 
낚시를 즐기지 않는다면 잡힌 빙어를 먹는 것에 도전해보자. 생각이 바뀔지도? 
",R,128.1524705,38.04018158,http://farm9.staticflickr.com/8065/8209454399_29049e941a_z.jpg,http://farm9.staticflickr.com/8341/8180723299_ecc2784dec_m.jpg,강원도 인제군 소양호
울산바위,44,울산바위,"봉우리가 여섯개인 울산바위는 큰 바람이 불면 산이 먼저 울어서 이름이 지어졌다고도 알려져 있다.
 
울산바위와 관련된 또 하나의 전설은 금강산을 찾아 떠돌아다니다가 설악산에 머물렀다는 이야기. 
 
이유야 어찌됐건 꼭 방문해야할 장소라는 것은 매한가지. 
",R,128.4652519,38.20150732,http://farm9.staticflickr.com/8481/8209454471_a50e5c5282_z.jpg,http://farm9.staticflickr.com/8060/8180723239_fc521d3b5f_m.jpg,강원 속초시 설악동 설악산국립공원
화성 방화수류정,45,화성 방화수류정,"방화수류정은 화성을 축조할 때 그 성곽 위에 꾸며졌던 정자와 누각 가운데 하나.
 
디테일이 정교한 건물로 뛰어난 아름다움을 보여주여 보물로 지정되었고 현재는 한국 전통음악과 시 그리고 공연 등을 즐길 수 있다. 
",R,127.0180923,37.28755856,http://farm9.staticflickr.com/8059/8209454533_35b118d201_z.jpg,http://farm9.staticflickr.com/8342/8180759484_033d5caf19_m.jpg,경기도 수원시 팔달구
무주 남대천 섶다리,46,무주 남대천 섶다리,"섶다리는 본래 나무 잔가지 등을 이용해 가교를 놓는 것이다. 이 섶다리는 사람들이 남대강을 보다 쉽게 건널 수 있도록 만들어진 것으로 초 겨울부터 여름까지 사용하다가 장마가 오면 자연스럽게 흘러내려갔다.
 
이제는 섶다리의 전통을 기억하기 위해 이 곳에서는 무주반딫불축제가 열린다.
",R,127.6623321,36.00546186,http://farm9.staticflickr.com/8064/8210542984_cc0155c291_z.jpg,http://farm9.staticflickr.com/8199/8180723581_9a492d0c6d_m.jpg,전라북도 무주군 무주읍 남대천
고창 동림저수지,47,고창 동림저수지,"매해 20만여마리의 쇠오리들이 이 지역에 날아드는데 이 아름답고 보기 드문 경관은 2004년에 철새의 왕국이라는 타이틀을 얻으며 그 유명세를 톡톡히 치뤘다. 
 
1935년에 지어진 저수지는 낚시로도 인기가 많은 명소이다. 
",R,126.719482,35.54824458,http://farm9.staticflickr.com/8207/8209454619_2df31a1d1c_z.jpg,http://farm9.staticflickr.com/8345/8180723529_b360ca78e1_m.jpg,전북 고창군 흥덕면/성내면
아침고요수목원,48,아침고요수목원,"아침고요수목원은 가평에 위차한 수목원으로 원예학 교수가 처음 설립했다. 20가지의 테마로 이루어진 수목원은 총 5,000여가지의 식물을 소개하고 있으며 3월 1일까지 루미나리에를 선보인다.
 
루미나리에를 선보이고 있는 현재 수목원은 매일 오전 9시부터 오후 9시까지 운영되며 주말에는 오전 9시부터 오후 10시까지 운영된다. 루미나리에는 해가 지면 꺼진다. 
 
루미나리에가 끝나면 수목원은 오전 8:30부터 운영된다. 
 
티켓 가격은 주말과 휴일에는 8,000원, 4월부터 11월까지는 평일에 7,000원, 12월부터 3월까지는 6,000원이다.  
",R,127.3524982,37.74178151,http://farm9.staticflickr.com/8197/8209454677_220fafb260_z.jpg,http://farm9.staticflickr.com/8066/8180723067_1631b0ed6c_m.jpg,경기도 가평군 상면 행현리 산 255번지
촉석루,49,촉석루,"남강을 바라보고 있는 이 아름다운 누각은 논개가 몸을 던졌던 곳으로 유명하다. 
 
누각에서 절벽을 바라보는 것은 좋지만 남강의 아름다움에 취해 뛰어내리지는 말도록. 
",R,128.0818612,35.18948881,http://farm9.staticflickr.com/8339/8210543130_ca5d29898c_z.jpg,http://farm9.staticflickr.com/8058/8180759406_6188afa17d_m.jpg,경상남도 진주시 본성동 573-1
삼광사 연등축제,50,삼광사 연등축제,"매년 석가탄신일이 되면 부산의 삼광사에 아름다운 연등축제가 열린다.
 
사찰 전체가 셀 수 없는 연등으로 장식되며 다양한 모양과 크기를 자랑하는 연등도 볼 수 있는 기회.
 
올해 석가탄신일은 5월 28일이니 미리 달력에 적어놓도록. 
",R,129.0433799,35.17569493,http://farm9.staticflickr.com/8068/8209454787_3ff8a0a71b_z.jpg,http://farm9.staticflickr.com/8203/8180723633_0cdf206613_m.jpg,부산광역시 부산진구 초읍동 산 131
